,Publisher,Ticker,Title,Date,Platforms,Developers,Subreddits
0,Activision,ATVI,Call of Duty: Black Ops 4,"2018, 8, 3","PlayStation 4, Xbox One, Microsoft Windows","Treyarch, Raven Software, Beenox","Blackops4, CallOfDuty"
1,Activision,ATVI,Call of Duty: Black Ops Cold War,"2020, 11, 13",PlayStation 5,"Treyarch, Raven Software, Beenox","CallOfDuty, blackopscoldwar"
2,Activision,ATVI,Call of Duty: Infinite Warfare,"2016, 11, 4","Microsoft Windows, Xbox One, PlayStation 4",Infinity Ward,"CallOfDuty, Infinitewarfare"
3,Activision,ATVI,Call of Duty: Modern Warfare,"2019, 8, 23","Microsoft Windows, PlayStation 4, Xbox One, Microsoft Windows, Xbox One, PlayStation 4","Infinity Ward, Sledgehammer Games","CallOfDuty, modernwarfare"
4,Activision,ATVI,Call of Duty: WWII,"2017, 11, 3","Microsoft Windows, Xbox One, PlayStation 4","Raven Software, Sledgehammer Games","CallOfDuty, CallOfDutyWorldWarTwo"
5,Activision,ATVI,Call of Duty: Warzone,"2020, 3, 10","Microsoft Windows, PlayStation 4, Xbox One","Infinity Ward, Raven Software","CallOfDuty, Warzone, CODWarzone"
6,Activision,ATVI,Crash Bandicoot 4: It's About Time,"2020, 9, 16","PlayStation 4, Xbox One",Toys for Bob,crashbandicoot
7,Activision,ATVI,Crash Bandicoot N. Sane Trilogy,"2017, 6, 30","PlayStation 4, Xbox One, Nintendo Switch","Toys for Bob, Vicarious Visions, Iron Galaxy",crashbandicoot
8,Activision,ATVI,Destiny 2,"2017, 9, 6","PlayStation 4, Xbox One, Microsoft Windows",Bungie Inc,destiny2
9,Activision,ATVI,Sekiro: Shadows Die Twice,"2019, 3, 22","Microsoft Windows, PlayStation 4, Xbox One","FromSoftware, Inc.",Sekiro
11,Activision,ATVI,Call of Duty: Advanced Warfare,"2014, 11, 4","PlayStation 4, Xbox One, Microsoft Windows",Sledgehammer Games,"callofduty, CodAW"
13,Activision,ATVI,Call of Duty: Black Ops,"2010, 11, 9","PlayStation 3, Xbox 360, Microsoft Windows",Treyarch,"CallOfDuty, codbo"
14,Activision,ATVI,Call of Duty: Black Ops 2,"2012, 11, 18","PlayStation 3, Xbox 360, Microsoft Windows",Treyarch,"CallOfDuty, blackops2"
15,Activision,ATVI,Call of Duty: Black Ops 3,"2015, 11, 6","PlayStation 3, Xbox 360, Microsoft Windows, PlayStation 4, Xbox One",Treyarch,"CallOfDuty, blackops3"
16,Activision,ATVI,Call of Duty: Ghosts,"2013, 11, 15","PlayStation 3, Xbox 360, Microsoft Windows, PlayStation 4, Xbox One",Infinity Ward,"CallOfDuty, CODGhosts"
17,Activision,ATVI,Call of Duty: Modern Warfare 3,"2011, 11, 8","PlayStation 3, Xbox 360, Microsoft Windows",Infinity Ward,"CallOfDuty, mw3"
18,Activision,ATVI,Chivalry: Medieval Warfare,"2012, 11, 16","PlayStation 3, Xbox 360, Microsoft Windows, PlayStation 4, Xbox One",Torn Banner Studios,ChivalryGame
19,Activision,ATVI,Deadpool,"2013, 6, 25","PlayStation 3, Xbox 360, Microsoft Windows, PlayStation 4, Xbox One",High Moon Studios,deadpool
20,Activision,ATVI,Destiny,"2014, 9, 9","PlayStation 3, Xbox 360, PlayStation 4, Xbox One",Bungie,DestinyTheGame
21,Activision,ATVI,Skylanders: Giants,"2012, 10, 17","PlayStation 3, Xbox 360",Toys for Bob,skylanders
22,Activision,ATVI,Skylanders: Imaginators,"2016, 10, 13","PlayStation 3, Xbox 360, Microsoft Windows, PlayStation 4, Xbox One",Toys for Bob,skylanders
23,Activision,ATVI,Skylanders: Spyro's Adventure,"2011, 10, 16","PlayStation 3, Xbox 360",Toys for Bob,skylanders
24,Activision,ATVI,Skylanders: SuperChargers,"2015, 9, 20","PlayStation 3, Xbox 360, Microsoft Windows, PlayStation 4, Xbox One",Toys for Bob,skylanders
25,Activision,ATVI,Skylanders: Swap Force,"2013, 10, 13","PlayStation 3, Xbox 360, Microsoft Windows, PlayStation 4, Xbox One",Vicarious Visions,skylanders
26,Activision,ATVI,Skylanders: Trap Team,"2014, 10, 2","PlayStation 3, Xbox 360, Microsoft Windows, PlayStation 4, Xbox One",Toys for Bob,skylanders
27,Activision,ATVI,Tony Hawk's Pro Skater 5,"2015, 9, 29","PlayStation 3, Xbox 360, PlayStation 4, Xbox One",Robomodo,THPS
6,Ubisoft,UBSFY,Assassin's Creed III,"2012, 10, 30","PlayStation 3, Xbox 360, Wii U, Microsoft Windows","Ubisoft Montreal, Ubisoft Annecy, Ubisoft Bucharest, Ubisoft Quebec, Ubisoft Shanghai, Ubisoft Singapore",assassinscreed
9,Ubisoft,UBSFY,Assassin's Creed IV: Black Flag,"2013, 11, 22","Xbox One, Microsoft Windows, PlayStation 4, PlayStation 3, Xbox 360","Ubisoft Montreal, Ubisoft Annecy, Ubisoft Bucharest, Ubisoft Chengdu, Ubisoft Milan, Ubisoft Montpellier, Ubisoft Quebec, Ubisoft Shanghai, Ubisoft Singapore, Ubisoft Sofia",assassinscreed
10,Ubisoft,UBSFY,Assassin's Creed Odyssey,"2019, 11, 19","Stadia, Microsoft Windows, PlayStation 4, Xbox One","Ubisoft Quebec, Sperasoft, Ubisoft Bucharest, Ubisoft Chengdu, Ubisoft Kyiv, Ubisoft Montreal, Ubisoft Philippines, Ubisoft Shanghai, Ubisoft Singapore","assassinscreed, AssassinsCreedOdyssey"
11,Ubisoft,UBSFY,Assassin's Creed Origins,"2017, 10, 27","Microsoft Windows, PlayStation 4, Xbox One","Ubisoft Montreal, Ubisoft Bucharest, Ubisoft Chengdu, Ubisoft Kyiv, Ubisoft Montpellier, Ubisoft Quebec, Ubisoft Philippines, Ubisoft Shanghai, Ubisoft Singapore, Ubisoft Sofia","assassinscreed, AssassinsCreedOrigins"
12,Ubisoft,UBSFY,Assassin's Creed Rogue,"2015, 3, 10","Microsoft Windows, PlayStation 3, Xbox 360",Ubisoft Kyiv,assassinscreed
14,Ubisoft,UBSFY,Assassin's Creed Syndicate,"2015, 11, 18","Microsoft Windows, PlayStation 4, Xbox One",Ubisoft Kyiv,assassinscreed
15,Ubisoft,UBSFY,Assassin's Creed Unity,"2014, 11, 11","Microsoft Windows, PlayStation 4, Xbox One","Ubisoft Montreal, Ubisoft Annecy, Ubisoft Kyiv, Ubisoft Quebec, Ubisoft Shanghai, Ubisoft Singapore, Ubisoft Toronto",assassinscreed
16,Ubisoft,UBSFY,Assassin's Creed Valhalla,"2020, 11, 10","Amazon Luna, Microsoft Windows, PlayStation 4, Stadia, Xbox One, Xbox Series S, Xbox Series X, PlayStation 5",Ubisoft Montreal,"assassinscreed, ACValhalla"
17,Ubisoft,UBSFY,Assassin's Creed: Brotherhood,"2010, 11, 16","PlayStation 3, Xbox 360, Microsoft Windows","Ubisoft Montreal, Ubisoft Annecy, Ubisoft Bucharest, Ubisoft Quebec, Ubisoft Shanghai",assassinscreed
19,Ubisoft,UBSFY,Assassin's Creed: Revelations,"2011, 11, 15","PlayStation 3, Xbox 360, Microsoft Windows","Ubisoft Montreal, Massive Entertainment, Ubisoft Annecy, Ubisoft Bucharest, Ubisoft Quebec, Ubisoft Singapore",assassinscreed
46,Ubisoft,UBSFY,Far Cry 3,"2012, 12, 4","Microsoft Windows, PlayStation 3, Xbox 360","Ubisoft Montreal, Massive Entertainment, Red Storm Entertainment, Ubisoft Shanghai","farcry, farcry3"
49,Ubisoft,UBSFY,Far Cry 4,"2014, 11, 18","Microsoft Windows, PlayStation 3, PlayStation 4, Xbox 360, Xbox One","Ubisoft Montreal, Red Storm Entertainment, Ubisoft Kyiv, Ubisoft Shanghai, Ubisoft Toronto","farcry, FarCry4"
50,Ubisoft,UBSFY,Far Cry 5,"2018, 3, 27","Microsoft Windows, PlayStation 4, Xbox One","Ubisoft Montreal, Ubisoft Toronto, Red Storm Entertainment, Ubisoft Kyiv, Ubisoft Reflections, Ubisoft Shanghai",farcry
51,Ubisoft,UBSFY,Far Cry Classic,"2014, 2, 11","PlayStation 3, Xbox 360",Crytek,farcry
52,Ubisoft,UBSFY,Far Cry New Dawn,"2019, 2, 15","Microsoft Windows, PlayStation 4, Xbox One","Ubisoft Montreal, Ubisoft Kyiv, Ubisoft Shanghai","farcry, FarCryNewDawn"
53,Ubisoft,UBSFY,Far Cry Primal,"2016, 3, 1","Microsoft Windows, PlayStation 4, Xbox One","Ubisoft Montreal, Ubisoft Kyiv, Ubisoft Shanghai, Ubisoft Toronto",farcry
57,Ubisoft,UBSFY,For Honor,"2017, 2, 14","Microsoft Windows, PlayStation 4, Xbox One","Ubisoft Montreal, Studio Gobo, Ubisoft Blue Byte, Ubisoft Quebec",forhonor
73,Ubisoft,UBSFY,Immortals Fenyx Rising,"2020, 12, 3","Amazon Luna, Microsoft Windows, Nintendo Switch, PlayStation 4, PlayStation 5, Stadia, Xbox One, Xbox Series S, Xbox Series X",Ubisoft Quebec,"FenyxRising, ImmortalsFenyxRisin"
127,Ubisoft,UBSFY,Rayman Legends,"2014, 2, 18","PlayStation 4, Xbox One, Microsoft Windows, PlayStation 3, PlayStation Vita, Wii U, Xbox 360",Ubisoft Montpellier,Rayman
129,Ubisoft,UBSFY,Rayman Origins,"2011, 11, 15","PlayStation 3, Wii, Xbox 360, PlayStation Vita, Microsoft Windows, Nintendo 3DS","Ubisoft Montpellier, Ubisoft Paris, Ubisoft Casablanca",Rayman
132,Ubisoft,UBSFY,Rocksmith,"2012, 10, 16","Microsoft Windows, PlayStation 3, Xbox 360","Ubisoft San Francisco, Ubisoft Shanghai",rocksmith
133,Ubisoft,UBSFY,Rocksmith: All-new 2014 Edition,"2013, 11, 4","PlayStation 4, Xbox One, Mac OS, Microsoft Windows, PlayStation 3","Ubisoft San Francisco, Red Storm Entertainment, Longtail Studios",rocksmith
134,Ubisoft,UBSFY,Rocksmith: All-new 2014 Edition - Remastered,"2016, 10, 4","Mac OS, Microsoft Windows, PlayStation 4, Xbox One","Ubisoft San Francisco, Red Storm Entertainment, Longtail Studios",rocksmith
140,Ubisoft,UBSFY,South Park: The Fractured But Whole,"2018, 4, 24","Nintendo Switch, Microsoft Windows, PlayStation 4, Xbox One","Ubisoft San Francisco, South Park Digital Studios, Massive Entertainment, Ubisoft Blue Byte, Ubisoft Osaka, Ubisoft Pune, Ubisoft Reflections","southpark, FracturedButWhole"
141,Ubisoft,UBSFY,South Park: The Stick of Truth,"2018, 9, 25","Nintendo Switch, PlayStation 4, Xbox One, Microsoft Windows, PlayStation 3, Xbox 360","Obsidian Entertainment, South Park Digital Studios, Heavy Iron Studios, Magic Pixel Studios","southpark, StickofTruth"
151,Ubisoft,UBSFY,The Crew,"2014, 12, 2","Microsoft Windows, PlayStation 4, Xbox 360, Xbox One","Ivory Tower, Ubisoft Reflections",The_Crew
152,Ubisoft,UBSFY,The Crew 2,"2018, 6, 29","Microsoft Windows, PlayStation 4, Xbox One, Stadia","Ivory Tower, Asobo Studio, Ubisoft Montpellier, Ubisoft Shanghai","The_Crew, thecrew2"
158,Ubisoft,UBSFY,Tom Clancy's Ghost Recon Breakpoint,"2019, 12, 18","Stadia, Microsoft Windows, PlayStation 4, Xbox One","Ubisoft Paris, Ubisoft Belgrad, Ubisoft Bordeaux, Ubisoft Bucharest, Ubisoft Kyiv, Ubisoft Milan, Ubisoft Montpellier, Ubisoft Odesa","GhostRecon, GhostReconBreakpoint"
159,Ubisoft,UBSFY,Tom Clancy's Ghost Recon Predator,"2010, 11, 16",PlayStation Portable,Virtuos,GhostRecon
160,Ubisoft,UBSFY,Tom Clancy's Ghost Recon Wildlands,"2017, 3, 7","Microsoft Windows, PlayStation 4, Xbox One","Ubisoft Paris, Ubisoft Milan, Ubisoft Annecy, Ubisoft Belgrade, Ubisoft Bucharest, Ubisoft Montpellier, Ubisoft Reflections","GhostRecon, Wildlands"
161,Ubisoft,UBSFY,Tom Clancy's Ghost Recon: Future Soldier,"2012, 5, 22","PlayStation 3, Xbox 360, Microsoft Windows","Ubisoft Paris, Red Storm Entertainment, Ubisoft Annecy, Ubisoft Bucharest, Ubisoft Montpellier, Ubisoft Singapore",GhostRecon
164,Ubisoft,UBSFY,Tom Clancy's Rainbow Six Siege,"2015, 12, 1","Microsoft Windows, PlayStation 4, Xbox One, PlayStation 5, Xbox Series S, Xbox Series X","Ubisoft Montreal, Ubisoft Barcelona, Ubisoft Kyiv, Ubisoft Toronto",Rainbow6
168,Ubisoft,UBSFY,Tom Clancy's Splinter Cell: Blacklist,"2013, 8, 20","Microsoft Windows, PlayStation 3, Wii U, Xbox 360","Ubisoft Toronto, Red Storm Entertainment, Ubisoft Montreal, Ubisoft Shanghai",Splintercell
170,Ubisoft,UBSFY,Tom Clancy's Splinter Cell: Conviction,"2010, 4, 13","Xbox 360, Microsoft Windows, Mac OS",Ubisoft Montreal,Splintercell
172,Ubisoft,UBSFY,Tom Clancy's The Division,"2016, 3, 8","Microsoft Windows, PlayStation 4, Xbox One","Massive Entertainment, Red Storm Entertainment, Ubisoft Annecy, Ubisoft Leamington, Ubisoft Reflections","thedivision, The_Division"
173,Ubisoft,UBSFY,Tom Clancy's The Division 2,"2019, 3, 15","Microsoft Windows, PlayStation 4, Xbox One, Stadia","Massive Entertainment, Red Storm Entertainment, Ubisoft Annecy, Ubisoft Bucharest, Ubisoft Leamington, Ubisoft Reflections, Ubisoft Shanghai, Ubisoft Sofia","thedivision, the_division_2"
177,Ubisoft,UBSFY,Trials Evolution,"2012, 4, 18",Xbox Live Arcade,RedLynx,
178,Ubisoft,UBSFY,Trials Fusion,"2014, 4, 15","Microsoft Windows, PlayStation 4, Xbox 360, Xbox One","RedLynx, Ubisoft Kyiv, Ubisoft Shanghai",
179,Ubisoft,UBSFY,Trials Rising,"2019, 2, 26","Microsoft Windows, Nintendo Switch, PlayStation 4, Xbox One","RedLynx, Ubisoft Kyiv, Ubisoft Shanghai",
181,Ubisoft,UBSFY,Trivial Pursuit Live!,"2018, 10, 30","Nintendo Switch, PlayStation 3, PlayStation 4, Xbox 360, Xbox One",Ubisoft Chengdu,
185,Ubisoft,UBSFY,Watch Dogs,"2014, 11, 18","Wii U, Microsoft Windows, PlayStation 3, PlayStation 4, Xbox 360, Xbox One","Ubisoft Montreal, Ubisoft Paris, Ubisoft Reflections",
186,Ubisoft,UBSFY,Watch Dogs 2,"2016, 11, 15","Microsoft Windows, PlayStation 4, Xbox One","Ubisoft Montreal, Ubisoft Bucharest, Ubisoft Kyiv, Ubisoft Paris, Ubisoft Reflections, Ubisoft Toronto",
187,Ubisoft,UBSFY,Watch Dogs: Legion,"2020, 10, 29","Microsoft Windows, PlayStation 4, Stadia, Xbox One, Xbox Series S, Xbox Series X, PlayStation 5, Amazon Luna",Ubisoft Toronto,
189,Ubisoft,UBSFY,Werewolves Within,"2016, 12, 6","Microsoft Windows, PlayStation 4",Red Storm Entertainment,
0,CD Projekt,OTGLF,Cyberpunk 2077,"2020, 12, 10","Microsoft Windows, PlayStation 4, Stadia, Xbox One, PlayStation 5, Xbox Series X/S",CDPR,
1,CD Projekt,OTGLF,Gwent: The Witcher Card Game,"2018, 10, 25","Microsoft Windows, PlayStation 4, Xbox One, iOS, Android",CDPR,
2,CD Projekt,OTGLF,The Witcher 3: Wild Hunt,"2015, 5, 18","Microsoft Windows, PlayStation 4, Xbox One, Nintendo Switch, PlayStation 5, Xbox Series X/S",CDPR,
3,CD Projekt,OTGLF,Thronebreaker: The Witcher Tales,"2018, 10, 23","Microsoft Windows, PlayStation 4, Xbox One, Nintendo Switch, iOS, Android",CDPR,
4,CD Projekt,OTGLF,The Witcher 2: Assassins of Kings,"2011, 5, 17","Linux, macOS, Microsoft Windows, Xbox 360",CDPR,
1,2K Games,TTWO,Battleborn,"2016, 5, 3","Microsoft Windows, PlayStation 4, Xbox One",Gearbox Software / OMNOM! Workshop / Secret Sauce / Humouring the Fates / Liquid Development / Ghostpunch Games,
3,2K Games,TTWO,BioShock,"2016, 12, 13","Xbox One Backwards Compatible, iOS",2K Boston / 2K Australia,
4,2K Games,TTWO,BioShock 2,"2016, 12, 13","Xbox One Backwards Compatible, Microsoft Windows, PlayStation 3, Xbox 360, macOS",2K Marin / 2K Australia / 2K China / Digital Extremes,
5,2K Games,TTWO,BioShock Infinite,"2016, 12, 13","Xbox One Backwards Compatible, Linux, Microsoft Windows, PlayStation 3, Xbox 360, macOS",Irrational Games / 2K Australia,
7,2K Games,TTWO,Borderlands,"2015, 9, 3",Xbox One Backwards Compatible,Gearbox Software,
8,2K Games,TTWO,Borderlands 2,"2017, 2, 23","Xbox One Backwards Compatible, Android, Nvidia Shield Tablet, Linux, PlayStation Vita, Microsoft Windows, PlayStation 3, Xbox 360, macOS",Gearbox Software,
10,2K Games,TTWO,Borderlands 3,"2020, 11, 12","PlayStation 5, Xbox Series X/S, Stadia, macOS, Microsoft Windows, PlayStation 4, Xbox One",Gearbox Software / Gearbox Studio Québec,
13,2K Games,TTWO,Borderlands: The Handsome Collection,"2015, 3, 24","PlayStation 4, Xbox One",Armature Studio / Iron Galaxy Studios,
15,2K Games,TTWO,Borderlands: The Pre-Sequel!,"2016, 3, 31","Android, Nvidia Shield Tablet, Linux, macOS, Microsoft Windows, PlayStation 3, Xbox 360",Gearbox Software,
27,2K Games,TTWO,Duke Nukem Forever,"2018, 12, 5","Xbox One Backwards Compatible, Microsoft Windows, PlayStation 3, Xbox 360, macOS",Gearbox Software / Triptych Games / Piranha Games / 3D Realms,
28,2K Games,TTWO,Evolve,"2015, 2, 10","Microsoft Windows, PlayStation 4, Xbox One",Turtle Rock Studios / Agora Games / Blind Squirrel Games / Crytek / IllFonic / Mass Media Games,
31,2K Games,TTWO,Mafia II,"2018, 2, 15","Xbox One Backwards Compatible, Microsoft Windows, PlayStation 3, Xbox 360",2K Czech,
33,2K Games,TTWO,Mafia III,"2017, 5, 11","macOS, Microsoft Windows, PlayStation 4, Xbox One",Aspyr,
35,2K Games,TTWO,Major League Baseball 2K10,"2010, 3, 2","Microsoft Windows, Nintendo DS, PlayStation 2, PlayStation 3, PlayStation Portable, Wii, Xbox 360",Visual Concepts,
36,2K Games,TTWO,Major League Baseball 2K11,"2011, 3, 8","Microsoft Windows, Nintendo DS, PlayStation 2, PlayStation 3, PlayStation Portable, Wii, Xbox 360",Visual Concepts,
37,2K Games,TTWO,Major League Baseball 2K12,"2012, 3, 6","Microsoft Windows, Nintendo DS, PlayStation 2, PlayStation 3, PlayStation Portable, Wii, Xbox 360",Visual Concepts,
38,2K Games,TTWO,Major League Baseball 2K13,"2013, 3, 5","PlayStation 3, Xbox 360",Visual Concepts,
41,2K Games,TTWO,NBA 2K11,"2010, 10, 5","Microsoft Windows, PlayStation 2, PlayStation 3, PlayStation Portable, Wii, Xbox 360",Visual Concepts,
42,2K Games,TTWO,NBA 2K12,"2011, 10, 4","iOS, Microsoft Windows, PlayStation 2, PlayStation 3, PlayStation Portable, Wii, Xbox 360",2K China,
43,2K Games,TTWO,NBA 2K13,"2012, 10, 2","Android, iOS, Microsoft Windows, PlayStation 3, PlayStation Portable, Wii, Xbox 360, Wii U",2K China,
44,2K Games,TTWO,NBA 2K14,"2014, 3, 27","Android, Xbox One, PlayStation 4, Fire OS, iOS, Microsoft Windows, PlayStation 3, Xbox 360",Visual Concepts China,
45,2K Games,TTWO,NBA 2K15,"2014, 10, 15","Android, Fire OS, iOS, Microsoft Windows, PlayStation 3, PlayStation 4, Xbox 360, Xbox One",Visual Concepts China,
46,2K Games,TTWO,NBA 2K16,"2015, 10, 14","Android, iOS, Microsoft Windows, PlayStation 3, PlayStation 4, Xbox 360, Xbox One",Visual Concepts China,
47,2K Games,TTWO,NBA 2K17,"2016, 9, 22","Android, iOS, Microsoft Windows, PlayStation 3, PlayStation 4, Xbox 360, Xbox One",Visual Concepts China,
49,2K Games,TTWO,NBA 2K18,"2017, 12, 15","Android, iOS, Microsoft Windows, Nintendo Switch, PlayStation 3, PlayStation 4, Xbox 360, Xbox One",Visual Concepts China / Visual Concepts South Korea,
51,2K Games,TTWO,NBA 2K19,"2018, 10, 17","Android, iOS, Microsoft Windows, Nintendo Switch, PlayStation 4, Xbox One",Visual Concepts China / Visual Concepts South Korea,
53,2K Games,TTWO,NBA 2K20,"2019, 11, 19","Stadia, Microsoft Windows, Nintendo Switch, PlayStation 4, Xbox One, Android, iOS",Visual Concepts / Visual Concepts Budapest / Visual Concepts Orange County,
55,2K Games,TTWO,NBA 2K21,"2020, 11, 12","PlayStation 5, Xbox Series X/S, Microsoft Windows, Nintendo Switch, PlayStation 4, Xbox One, Stadia",Visual Concepts / Visual Concepts Budapest / Visual Concepts Orange County,
61,2K Games,TTWO,Prey,"2018, 2, 15",Xbox One Backwards Compatible,Venom Games,
62,2K Games,TTWO,Sid Meier's Civilization Revolution,"2017, 4, 4","Xbox One Backwards Compatible, Windows Phone",Firaxis Games / 2K China,
63,2K Games,TTWO,Sid Meier's Civilization Revolution 2 Plus,"2016, 3, 29",PlayStation Vita,Firaxis Games,
64,2K Games,TTWO,Sid Meier's Civilization VI,"2020, 8, 13","Android, PlayStation 4, Xbox One, Nintendo Switch, iOS, Linux, macOS, Microsoft Windows",Aspyr,
66,2K Games,TTWO,Spec Ops: The Line,"2018, 1, 30","Xbox One Backwards Compatible, Linux, Microsoft Windows, PlayStation 3, Xbox 360, macOS",Yager Development / Darkside Game Studios / Shadows in Darkness / 2K China / Blind Squirrel Games,
67,2K Games,TTWO,Tales from the Borderlands,"2016, 4, 26","Microsoft Windows, PlayStation 3, PlayStation 4, Xbox 360, Xbox One",Telltale Games,
70,2K Games,TTWO,The Bureau: XCOM Declassified,"2018, 12, 5","Xbox One Backwards Compatible, macOS, Microsoft Windows, PlayStation 3, Xbox 360",2K Marin / 2K Australia / 2K China,
76,2K Games,TTWO,WWE 2K Battlegrounds,"2020, 9, 18","Microsoft Windows, Nintendo Switch, PlayStation 4, Xbox One, Stadia",Saber Interactive,
77,2K Games,TTWO,WWE 2K14,"2013, 10, 29","PlayStation 3, Xbox 360",Yuke's / Visual Concepts,
78,2K Games,TTWO,WWE 2K15,"2015, 4, 28","Microsoft Windows, PlayStation 4, Xbox One, PlayStation 3, Xbox 360",QLOC,
79,2K Games,TTWO,WWE 2K16,"2016, 3, 11","Microsoft Windows, PlayStation 3, PlayStation 4, Xbox 360, Xbox One",QLOC,
80,2K Games,TTWO,WWE 2K17,"2017, 2, 7","Microsoft Windows, PlayStation 3, PlayStation 4, Xbox 360, Xbox One",Yuke's / Visual Concepts,
81,2K Games,TTWO,WWE 2K18,"2017, 12, 6","Nintendo Switch, Microsoft Windows, PlayStation 4, Xbox One",Blind Squirrel Games,
82,2K Games,TTWO,WWE 2K19,"2018, 10, 9","Microsoft Windows, PlayStation 4, Xbox One",Yuke's / Visual Concepts,
83,2K Games,TTWO,WWE 2K20,"2019, 10, 22","Microsoft Windows, PlayStation 4, Xbox One",Visual Concepts / HB Studios / Saber Interactive,
84,2K Games,TTWO,XCOM 2,"2016, 9, 27","PlayStation 4, Xbox One, Linux, macOS, Microsoft Windows",Firaxis Games / Blind Squirrel Games,
85,2K Games,TTWO,XCOM 2: Collection,"2020, 11, 5","iOS, Nintendo Switch",Aspyr,
86,2K Games,TTWO,XCOM: Enemy Unknown,"2016, 5, 24","Xbox One Backwards Compatible, Linux, Android, Microsoft Windows, PlayStation 3, Xbox 360, macOS, iOS",Firaxis Games / 2K China / Blind Squirrel Games,
87,2K Games,TTWO,XCOM: Enemy Unknown Plus,"2016, 3, 22",PlayStation Vita,Firaxis Games,
0,Rockstar Games,TTWO,Bully,"2016, 3, 22",PlayStation 2 Originals on PlayStation 4,Rockstar Vancouver,
1,Rockstar Games,TTWO,Grand Theft Auto III,"2015, 12, 5","PlayStation 2 Originals on PlayStation 4, Amazon Fire TV, Fire OS, Android, iOS, macOS",DMA Design,
2,Rockstar Games,TTWO,Grand Theft Auto IV: The Lost and Damned,"2010, 4, 13","Microsoft Windows, PlayStation 3, Xbox 360",Rockstar Toronto / Rockstar New England,
3,Rockstar Games,TTWO,Grand Theft Auto Online,"2015, 4, 14","Microsoft Windows, PlayStation 4, Xbox One, PlayStation 3, Xbox 360",Rockstar North,
4,Rockstar Games,TTWO,Grand Theft Auto V,"2015, 4, 14","Microsoft Windows, PlayStation 4, Xbox One, PlayStation 3, Xbox 360",Rockstar North / Rockstar San Diego / Rockstar Leeds / Rockstar Toronto / Rockstar New England / Rockstar London,
5,Rockstar Games,TTWO,Grand Theft Auto: Chinatown Wars,"2014, 12, 18","Android, Fire OS, iOS, PlayStation Portable, Nintendo DS",War Drum Studios,
6,Rockstar Games,TTWO,Grand Theft Auto: San Andreas,"2015, 12, 5","PlayStation 2 Originals on PlayStation 4, PlayStation 3, Xbox 360, Amazon Fire TV, Microsoft Windows Apps, Windows Phone, Android, Fire OS, iOS, macOS, Xbox Originals on Xbox 360",Rockstar North,
7,Rockstar Games,TTWO,Grand Theft Auto: The Ballad of Gay Tony,"2010, 4, 13","Microsoft Windows, PlayStation 3, Xbox 360",Rockstar Toronto / Rockstar New England,
8,Rockstar Games,TTWO,Grand Theft Auto: Vice City,"2015, 12, 5","PlayStation 2 Originals on PlayStation 4, Amazon Fire TV, Fire OS, Android, iOS, macOS",Rockstar North,
9,Rockstar Games,TTWO,Grand Theft Auto: iFruit,"2014, 4, 2","PlayStation Vita, Windows Phone, Android, iOS",Lucid Games,
10,Rockstar Games,TTWO,L.A. Noire,"2017, 11, 14","Nintendo Switch, PlayStation 4, Xbox One, Microsoft Windows, PlayStation 3, Xbox 360",Rockstar San Diego / Rockstar Toronto / Rockstar North / Rockstar Leeds / Virtuos,
11,Rockstar Games,TTWO,L.A. Noire: The VR Case Files,"2019, 9, 24","PlayStation VR, Oculus Rift, HTC Vive",Videogames Deluxe Sydney / Rockstar San Diego / Rockstar Toronto / Rockstar North / Rockstar Leeds / Virtuos,
12,Rockstar Games,TTWO,Manhunt,"2016, 3, 22",PlayStation 2 Originals on PlayStation 4,Rockstar North,
13,Rockstar Games,TTWO,Max Payne,"2016, 4, 22","PlayStation 2 Originals on PlayStation 4, Android, iOS, Xbox Originals on Xbox 360",Rockstar Canada,
14,Rockstar Games,TTWO,Max Payne 3,"2013, 6, 20","macOS, Microsoft Windows, PlayStation 3, Xbox 360",Rockstar Studios,
15,Rockstar Games,TTWO,Red Dead Online,"2019, 11, 19","Stadia, Microsoft Windows, PlayStation 4, Xbox One",Rockstar Studios,
16,Rockstar Games,TTWO,Red Dead Redemption,"2010, 5, 18","PlayStation 3, Xbox 360",Rockstar San Diego / Rockstar North / Rockstar Leeds / Rockstar New England,
17,Rockstar Games,TTWO,Red Dead Redemption 2,"2019, 11, 19","Stadia, Microsoft Windows, PlayStation 4, Xbox One",Rockstar Studios,
18,Rockstar Games,TTWO,Red Dead Redemption: Undead Nightmare,"2010, 10, 26","PlayStation 3, Xbox 360",Rockstar San Diego,
19,Rockstar Games,TTWO,Red Dead Revolver,"2016, 10, 11",PlayStation 2 Originals on PlayStation 4,Rockstar San Diego,
20,Rockstar Games,TTWO,The Warriors,"2016, 7, 6",PlayStation 2 Originals on PlayStation 4,Rockstar Toronto,
5,Electronic Arts,EA,Anthem,"2019, 2, 22","PlayStation 4, Windows, Xbox One",BioWare,
6,Electronic Arts,EA,Apex Legends,"2019, 2, 4","PlayStation 4, Windows, Xbox One",Respawn Entertainment,
7,Electronic Arts,EA,Army of Two: The 40th Day,"2010, 1, 12","PlayStation 3, Xbox 360, PlayStation Portable",EA Montreal,
8,Electronic Arts,EA,Army of Two: The Devil's Cartel,"2013, 3, 26","PlayStation 3, Xbox 360, PlayStation 3, Xbox 360",Visceral Games / EA Montreal,
10,Electronic Arts,EA,Battlefield 1,"2016, 10, 21","PlayStation 4, Windows, Xbox One",EA DICE,
11,Electronic Arts,EA,Battlefield 3,"2011, 10, 25","PlayStation 3, Windows, Xbox 360",EA DICE,
12,Electronic Arts,EA,Battlefield Bad Company 2,"2010, 3, 2","PlayStation 3, Windows, Xbox 360, iOS, Kindle Fire",EA DICE,
13,Electronic Arts,EA,Battlefield Hardline,"2015, 3, 17","PlayStation 3, PlayStation 4, Windows, Xbox 360, Xbox One",Visceral Games,
14,Electronic Arts,EA,Battlefield V,"2018, 11, 20","PlayStation 4, Windows, Xbox One",EA DICE,
18,Electronic Arts,EA,Command & Conquer 4: Tiberian Twilight,"2010, 3, 16","Windows, Xbox 360",EA Los Angeles,
20,Electronic Arts,EA,Crysis,"2011, 10, 4","PlayStation 3, Xbox 360",Crytek,
21,Electronic Arts,EA,Crysis 2,"2011, 3, 22","PlayStation 3, Windows, Xbox 360",Crytek,
22,Electronic Arts,EA,Crysis 3,"2013, 2, 19","PlayStation 3, Windows, Xbox 360, PlayStation 3, Windows, Xbox 360",Crytek,
24,Electronic Arts,EA,Dead Space 2,"2011, 1, 25","PlayStation 3, Windows, Xbox 360",Visceral Games,
25,Electronic Arts,EA,Dead Space 3,"2013, 2, 5","PlayStation 3, Windows, Xbox 360, PlayStation 3, Windows, Xbox 360",Visceral Games,
26,Electronic Arts,EA,Dead Space Ignition,"2010, 10, 12","PlayStation 3, Xbox 360",Visceral Games / Sumo Digital,
27,Electronic Arts,EA,Dead Space: Extraction,"2011, 1, 25",PlayStation 3,Visceral Games / Eurocom,
30,Electronic Arts,EA,Dragon Age II,"2011, 3, 8","Macintosh, PlayStation 3, Windows, Xbox 360",BioWare,
31,Electronic Arts,EA,Dragon Age: Inquisition,"2014, 11, 18","PlayStation 3, PlayStation 4, Windows, Xbox 360, Xbox One",BioWare,
32,Electronic Arts,EA,Dragon Age: Origins – Awakening,"2010, 3, 16","Macintosh, PlayStation 3, Windows, Xbox 360",BioWare Edmonton,
